[
    {
        "id": "networking-basics",
        "title": "Networking Basics",
        "category": "Networking",
        "description": "Test your fundamental networking knowledge.",
        "questions": [
            {
                "id": "q-net-base-01",
                "question": "Which of the following IP addresses is a private IP address?",
                "options": [
                    "8.8.8.8",
                    "192.168.1.100",
                    "1.1.1.1",
                    "17.253.144.10"
                ],
                "correctIndex": 1,
                "explanation": "192.168.0.0 to 192.168.255.255 is an RFC 1918 reserved private IPv4 address block.",
                "difficulty": "Beginner",
                "category": "Networking"
            },
            {
                "id": "q-net-base-02",
                "question": "What port does HTTPS use by default?",
                "options": [
                    "80",
                    "21",
                    "443",
                    "22"
                ],
                "correctIndex": 2,
                "explanation": "HTTPS encrypted web traffic uses TCP port 443 by default.",
                "difficulty": "Beginner",
                "category": "Networking"
            },
            {
                "id": "q-net-base-03",
                "question": "Which protocol is responsible for resolving domain names to IP addresses?",
                "options": [
                    "DHCP",
                    "FTP",
                    "HTTP",
                    "DNS"
                ],
                "correctIndex": 3,
                "explanation": "DNS (Domain Name System) translates human-readable domain names into routable IP addresses.",
                "difficulty": "Beginner",
                "category": "Networking"
            }
        ]
    },
    {
        "id": "windows-commands",
        "title": "Windows Commands",
        "category": "Windows",
        "description": "Check your Windows command line skills.",
        "questions": [
            {
                "id": "q-win-base-01",
                "question": "Which command displays the IP configuration on Windows?",
                "options": [
                    "ifconfig",
                    "ipconfig",
                    "netstat",
                    "ping"
                ],
                "correctIndex": 1,
                "explanation": "ipconfig is the native Windows utility for displaying and refreshing TCP/IP configuration.",
                "difficulty": "Beginner",
                "category": "Windows"
            }
        ]
    },
    {
        "id": "networking-core",
        "title": "Networking Protocols & Architecture",
        "category": "Networking",
        "description": "Test your mastery of TCP/IP, routing, switching, DNS, and network diagnostics.",
        "questions": [
            {
                "id": "q-net-01",
                "question": "How many usable host IP addresses are available in a standard /24 IPv4 subnet?",
                "options": [
                    "256",
                    "254",
                    "255",
                    "252"
                ],
                "correctIndex": 1,
                "explanation": "A /24 subnet contains 256 total IP addresses (2^8), but 2 addresses are reserved: the network ID (.0) and the broadcast address (.255), leaving 254 usable host addresses.",
                "difficulty": "Beginner",
                "category": "Networking"
            },
            {
                "id": "q-net-02",
                "question": "Which transport layer protocol provides connection-oriented, reliable, and in-order delivery of segments?",
                "options": [
                    "UDP",
                    "TCP",
                    "ICMP",
                    "IGMP"
                ],
                "correctIndex": 1,
                "explanation": "TCP (Transmission Control Protocol) is connection-oriented, establishing a three-way handshake and using sequence numbers and ACKs to guarantee reliable, in-order delivery.",
                "difficulty": "Beginner",
                "category": "Networking"
            },
            {
                "id": "q-net-03",
                "question": "What default TCP port is used by Secure Shell (SSH) for encrypted remote terminal access?",
                "options": [
                    "21",
                    "22",
                    "23",
                    "25"
                ],
                "correctIndex": 1,
                "explanation": "SSH uses standard TCP port 22. In contrast, port 21 is FTP control, port 23 is unencrypted Telnet, and port 25 is SMTP.",
                "difficulty": "Beginner",
                "category": "Networking"
            },
            {
                "id": "q-net-04",
                "question": "What is the correct order of packet flags exchanged during a standard TCP connection establishment?",
                "options": [
                    "SYN, ACK, SYN-ACK",
                    "SYN, SYN-ACK, ACK",
                    "ACK, SYN, ACK",
                    "RST, SYN, FIN"
                ],
                "correctIndex": 1,
                "explanation": "The standard TCP three-way handshake begins with the client sending SYN, the server responding with SYN-ACK, and the client acknowledging with ACK.",
                "difficulty": "Intermediate",
                "category": "Networking"
            },
            {
                "id": "q-net-05",
                "question": "When configuring an 802.1Q trunk link between two switches, what header is inserted into Ethernet frames to preserve VLAN membership?",
                "options": [
                    "A 4-byte 802.1Q tag containing a 12-bit VLAN ID",
                    "A 16-byte MPLS label",
                    "An 8-byte GRE tunneling header",
                    "An IPsec Encapsulating Security Payload"
                ],
                "correctIndex": 0,
                "explanation": "IEEE 802.1Q inserts a 4-byte tag into standard Ethernet frames, which includes a 12-bit VLAN Identifier (VID) supporting up to 4,094 distinct VLANs.",
                "difficulty": "Intermediate",
                "category": "Networking"
            },
            {
                "id": "q-net-06",
                "question": "A workstation on subnet 192.168.1.0/24 needs to send an IP packet to 8.8.8.8. Which Layer 2 MAC address does the workstation place in the destination MAC field?",
                "options": [
                    "The MAC address of 8.8.8.8",
                    "The MAC address of its default gateway router",
                    "FF:FF:FF:FF:FF:FF (Broadcast)",
                    "The MAC address of the local DNS server"
                ],
                "correctIndex": 1,
                "explanation": "Because 8.8.8.8 is outside the local /24 subnet, the host forwards the packet to its local default gateway router, using ARP to discover and insert the gateway router's MAC address.",
                "difficulty": "Intermediate",
                "category": "Networking"
            },
            {
                "id": "q-net-07",
                "question": "What is the four-step message exchange sequence performed during DHCP address assignment?",
                "options": [
                    "Discover, Offer, Request, Acknowledge (DORA)",
                    "Request, Offer, Assign, Confirm",
                    "Discover, Ping, Bind, Release",
                    "Solicit, Advertise, Renew, Confirm"
                ],
                "correctIndex": 0,
                "explanation": "Standard IPv4 DHCP address lease allocation follows the DORA sequence: DHCPDISCOVER (broadcast by client), DHCPOFFER (unicast/broadcast by server), DHCPREQUEST (client selection), and DHCPACK (server confirmation).",
                "difficulty": "Intermediate",
                "category": "Networking"
            },
            {
                "id": "q-net-08",
                "question": "Which DNS resource record type maps a canonical domain name alias to another true domain name?",
                "options": [
                    "A Record",
                    "PTR Record",
                    "CNAME Record",
                    "MX Record"
                ],
                "correctIndex": 2,
                "explanation": "A CNAME (Canonical Name) record aliases one domain name to another canonical name. In contrast, A maps to IPv4, PTR maps IP to name, and MX specifies mail exchangers.",
                "difficulty": "Intermediate",
                "category": "Networking"
            },
            {
                "id": "q-net-09",
                "question": "How does BGP (Border Gateway Protocol) fundamentally differ from link-state interior routing protocols like OSPF?",
                "options": [
                    "BGP is a path-vector protocol that routes based on autonomous system paths (AS_PATH) and policy rules rather than raw link cost",
                    "BGP only supports broadcast Ethernet media",
                    "BGP floods link-state advertisements (LSAs) every 10 seconds",
                    "BGP relies solely on hop-count with a maximum of 15 hops"
                ],
                "correctIndex": 0,
                "explanation": "BGP is an exterior path-vector protocol that makes routing decisions based on autonomous system paths (AS_PATH attribute), local preference, and administrative policies rather than link speed or metric cost.",
                "difficulty": "Advanced",
                "category": "Networking"
            },
            {
                "id": "q-net-10",
                "question": "In TCP connection teardown, what is the purpose of the client entering the TIME_WAIT state after sending the final ACK?",
                "options": [